{"chapter":113,"name":{"arabic":"الفلق","transliteration":"Al-Falaq","translation":"The Dawn","revelation":"meccan"},"revelation":"meccan","verses":5,"content":[{"verse":1,"arabic":"بِسْمِ اللَّهِ الرَّحْمَٰنِ الرَّحِيمِ قُلْ أَعُوذُ بِرَبِّ الْفَلَقِ","transliteration":"Qul a'uzoo bi rabbil-falaq","translations":{"en.ahmedali":"SAY: \"I SEEK refuge with the Lord of rising day","en.ahmedraza":"Proclaim (O dear Prophet Mohammed – peace and blessings be upon him), “I take refuge of the One Who creates the Daybreak.”","en.arberry":"Say: 'I take refuge with the Lord of the Daybreak","en.asad":"SAY: \"I seek refuge with the Sustainer of the rising dawn,","en.daryabadi":"Say thou; I seek refuge with the Lord of the daybreak.","en.hilali":"Say: \"I seek refuge with (Allah) the Lord of the daybreak,","en.pickthall":"Say: I seek refuge in the Lord of the Daybreak","en.qaribullah":"Say: 'I take refuge with the Lord of Daybreak","en.sahih":"Say, \"I seek refuge in the Lord of daybreak","en.sarwar":"(Muhammad), say, \"I seek protection from the Lord of the Dawn","en.yusufali":"Say: I seek refuge with the Lord of the Dawn","en.maududi":"Say: “I seek refuge with the Lord of the rising day;","en.shakir":"Say: I seek refuge in the Lord of the dawn,","en.itani":"Say, “I take refuge with the Lord of Daybreak.","en.mubarakpuri":"Say: \"I seek refuge with the Lord of Al-Falaq,\"","en.qarai":"Say, ‘I seek the protection of the Lord of the daybreak","en.wahiduddin":"Say, \"I seek refuge in the Lord of the daybreak"},"tafsir":{"ar.muyassar":"قل -أيها الرسول-: أعوذ وأعتصم برب الفلق، وهو الصبح.","ar.jalalayn":"«قل أعوذ برب الفلق» الصبح.","ar.qurtubi":"تفسير سورة الفلقوهي خمس آياتو هي مكية في قول الحسن وعكرمة وعطاء وجابر ، ومدنية في أحد قولي ابن عباس وقتادة وهذه السورة وسورة ( الناس ) و ( الإخلاص ) : تعوذ بهن رسول الله - صلى الله عليه وسلم - حين سحرته اليهود ؛ على ما يأتي . وقيل : إن المعوذتين كان يقال لهما المقشقشتان ؛ أي تبرئان من النفاق . وقد تقدم . وزعم ابن مسعود أنهما دعاء تعوذ به ، وليستا من القرآن ؛ خالف به الإجماع من الصحابة وأهل البيت . قال ابن قتيبة : لم يكتب عبد الله بن مسعود في مصحفه المعوذتين ؛ لأنه كان يسمع رسول الله - صلى الله عليه وسلم - يعوذ الحسن والحسين - رضي الله عنهما - بهما ، فقدر أنهما بمنزلة : أعيذكما بكلمات الله التامة ، من كل شيطان وهامة ، ومن كل عين لامة . قال أبو بكر الأنباري : وهذا مردود على ابن قتيبة ؛ لأن المعوذتين من كلام رب العالمين ، المعجز لجميع المخلوقين ؛ و ( أعيذكما بكلمات الله التامة ) من قول البشر بين . وكلام الخالق الذي هو آية لمحمد - صلى الله عليه وسلم - خاتم النبيين ، وحجة له باقية على جميع الكافرين ، لا يلتبس بكلام الآدميين ، على مثل عبد الله بن مسعود الفصيح اللسان ، العالم باللغة ، العارف بأجناس الكلام ، وأفانين القول . وقال بعض الناس : لم يكتب عبد الله المعوذتين لأنه أمن عليهما من النسيان ، فأسقطهما وهو يحفظهما ؛ كما أسقط فاتحة الكتاب من مصحفه ، وما يشك في حفظه وإتقانه لها . فرد هذا القول على قائله ، واحتج عليه بأنه قد كتب : إذا جاء نصر الله والفتح ، و إنا أعطيناك الكوثر ، و قل هو الله أحد وهن يجرين مجرى المعوذتين في أنهن غير طوال ، والحفظ إليهن أسرع ، ونسيانهن مأمون ، وكلهن يخالف فاتحة الكتاب ؛ إذ الصلاة لا تتم إلا بقراءتها . وسبيل كل ركعة أن تكون المقدمة فيها قبل ما يقرأ من بعدها ، فإسقاط فاتحة الكتاب [ ص: 226 ] من المصحف ، على معنى الثقة ببقاء حفظها ، والأمن من نسيانها ، صحيح ، وليس من السور ما يجري في هذا المعنى مجراها ، ولا يسلك به طريقها . وقد مضى هذا المعنى في سورة ( الفاتحة ) . والحمد لله .بسم الله الرحمن الرحيم قل أعوذ برب الفلقروى النسائي عن عقبة بن عامر ، قال : أتيت النبي - صلى الله عليه وسلم - وهو راكب ، فوضعت يدي على قدمه ، فقلت : أقرئني سورة ( هود ) أقرئني سورة يوسف . فقال لي : \" لن تقرأ شيئا أبلغ عند الله من قل أعوذ برب الفلق \" . وعنه قال : بينا أنا أسير مع النبي - صلى الله عليه وسلم - بين الجحفة والأبواء ، إذ غشتنا ريح مظلمة شديدة ، فجعل رسول الله - صلى الله عليه وسلم - يتعوذ بـ أعوذ برب الفلق ، و أعوذ برب الناس ، ويقول : \" يا عقبة ، تعوذ بهما فما تعوذ متعوذ بمثلهما \" . قال : وسمعته يقرأ بهما في الصلاة . وروى النسائي عن عبد الله قال : أصابنا طش وظلمة ، فانتظرنا رسول الله - صلى الله عليه وسلم - يخرج . ثم ذكر كلاما معناه : فخرج رسول الله - صلى الله عليه وسلم - ليصلي بنا ، فقال : قل . فقلت : ما أقول ؟ قال : \" قل هو الله أحد والمعوذتين حين تمسي ، وحين تصبح ثلاثا ، يكفيك كل شيء \" .وعن عقبة بن عامر الجهني قال : قال لي رسول الله - صلى الله عليه وسلم - : \" قل \" . قلت : ما أقول ؟ قال : [ ص: 227 ] \" قل : قل هو الله أحد . قل أعوذ برب الفلق . قل أعوذ برب الناس - فقرأهن رسول الله - صلى الله عليه وسلم - ، ثم قال : لم يتعوذ الناس بمثلهن ، أو لا يتعوذ الناس بمثلهن \" . وفي حديث ابن عباس ( قل أعوذ برب الفلق وقل أعوذ برب الناس ، هاتين السورتين ) . وفي صحيح البخاري ومسلم عن عائشة أن النبي - صلى الله عليه وسلم - كان إذا اشتكى قرأ على نفسه بالمعوذتين وينفث ، كلما اشتد وجعه كنت أقرأ عليه ، وأمسح عنه بيده ، رجاء بركتها . النفث : النفخ ليس معه ريق .ثبت في الصحيحين من حديث عائشة أن النبي - صلى الله عليه وسلم - سحره يهودي من يهود بني زريق ، يقال له لبيد بن الأعصم ، حتى يخيل إليه أنه كان يفعل الشيء ولا يفعله ، فمكث كذلك ما شاء الله أن يمكث - في غير الصحيح : سنة - ثم قال : \" يا عائشة أشعرت أن الله أفتاني فيما استفتيته فيه . أتاني ملكان ، فجلس أحدهما عند رأسي ، والآخر عند رجلي ، فقال الذي عند رأسي للذي عند رجلي : ما شأن الرجل ؟ قال : مطبوب . قال ومن طبه ؟ قال لبيد بن الأعصم . قال في ماذا ؟ قال في مشط ومشاطة وجف طلعة ذكر ، تحت راعوفة في بئر ذي أروان \" فجاء البئر واستخرجه . انتهى الصحيح .وقال ابن عباس : \" أما شعرت يا عائشة أن الله تعالى أخبرني بدائي \" . ثم بعث عليا والزبير وعمار بن ياسر ، فنزحوا ماء تلك البئر كأنه نقاعة الحناء ، ثم رفعوا الصخرة وهي الراعوفة - صخرة تترك أسفل البئر يقوم عليها المائح ، وأخرجوا الجف ، فإذا مشاطة رأس إنسان ، وأسنان من مشط ، وإذا وتر معقود فيه إحدى عشرة عقدة مغرزة بالإبر ، فأنزل الله تعالى هاتين السورتين ، وهما إحدى عشرة آية على عدد تلك العقد ، وأمر أن يتعوذ بهما ؛ فجعل كلما قرأ آية انحلت عقدة ، ووجد النبي - صلى الله عليه وسلم - خفة ، حتى انحلت العقدة الأخيرة ، فكأنما أنشط من عقال ، وقال : ليس به بأس . وجعل جبريل يرقي رسول الله - صلى الله عليه وسلم - فيقول : \" باسم الله أرقيك ، من كل شيء يؤذيك ، من شر حاسد وعين ، والله يشفيك \" . فقالوا : يا رسول الله ، ألا نقتل الخبيث . فقال : \" أما أنا فقد شفاني الله ، وأكره أن [ ص: 228 ] أثير على الناس شرا \" . وذكر القشيري في تفسيره أنه ورد في الصحاح : أن غلاما من اليهود كان يخدم النبي - صلى الله عليه وسلم - ، فدست إليه اليهود ، ولم يزالوا به حتى أخذ مشاطة رأس النبي - صلى الله عليه وسلم - . والمشاطة ( بضم الميم ) : ما يسقط من الشعر عند المشط . وأخذ عدة من أسنان مشطه ، فأعطاها اليهود ، فسحروه فيها ، وكان الذي تولى ذلك لبيد بن الأعصم اليهودي . وذكر نحو ما تقدم عن ابن عباس .تقدم في ( البقرة ) القول في السحر وحقيقته ، وما ينشأ عنه من الآلام والمفاسد ، وحكم الساحر ؛ فلا معنى لإعادته .قوله تعالى : الفلق اختلف فيه ؛ فقيل : سجن في جهنم ؛ قاله ابن عباس . وقال أبي بن كعب : بيت في جهنم إذا فتح صاح أهل النار من حره . وقال الحبلي أبو عبد الرحمن : هو اسم من أسماء جهنم . وقال الكلبي : واد في جهنم . وقال عبد الله بن عمر : شجرة في النار . سعيد بن جبير : جب في النار . النحاس : يقال لما اطمأن من الأرض فلق ؛ فعلى هذا يصح هذا القول . وقال جابر بن عبد الله والحسن وسعيد بن جبير أيضا ومجاهد وقتادة والقرظي وابن زيد : الفلق ، الصبح . وقاله ابن عباس . تقول العرب : هو أبين من فلق الصبح وفرق الصبح . وقال الشاعر :يا ليلة لم أنمها بت مرتفقا أرعى النجوم إلى أن نور الفلقوقيل : الفلق : الجبال والصخور تنفرد بالمياه ؛ أي تتشقق . وقيل : هو التفليق بين الجبال والصخور ؛ لأنها تتشقق من خوف الله - عز وجل - . قال زهير :ما زلت أرمقهم حتى إذا هبطت     أيدي الركاب بهم من راكس فلقاالراكس : بطن الوادي . وكذلك هو في قول النابغة :[ وعيد أبي قابوس في غير كنهه ]     أتاني ودوني راكس فالضواجعوالراكس أيضا : الهادي ، وهو الثور وسط البيدر ، تدور عليه الثيران في الدياسة . وقيل : الرحم تنفلق بالحيوان . وقيل : إنه كل ما انفلق عن جميع ما خلق من الحيوان والصبح والحب [ ص: 229 ] والنوى ، وكل شيء من نبات وغيره ؛ قاله الحسن وغيره . قال الضحاك : الفلق الخلق كله ؛ قال :وسوس يدعو مخلصا رب الفلق     سرا وقد أون تأوين العقققلت : هذا القول يشهد له الاشتقاق ؛ فإن الفلق الشق . فلقت الشيء فلقا أي شققته . والتفليق مثله . يقال : فلقته فانفلق وتفلق . فكل ما انفلق عن شيء من حيوان وصبح وحب ونوى وماء فهو فلق ؛ قال الله تعالى : فالق الإصباح قال : فالق الحب والنوى . وقال ذو الرمة يصف الثور الوحشي :حتى إذا ما انجلى عن وجهه فلق     هاديه في أخريات الليل منتصبيعني بالفلق هنا : الصبح بعينه . والفلق أيضا : المطمئن من الأرض بين الربوتين ، وجمعه : فلقان ؛ مثل خلق وخلقان ، وربما قال : كان ذلك بفالق كذا وكذا ؛ يريدون المكان المنحدر بين الربوتين ، والفلق أيضا مقطرة السجان . فأما الفلق ( بالكسر ) : فالداهية والأمر العجب ؛ تقول منه : أفلق الرجل وافتلق . وشاعر مفلق ، وقد جاء بالفلق أي بالداهية . والفلق أيضا : القضيب يشق باثنين ، فيعمل منه قوسان ، يقال لكل واحدة منهما فلق ، وقولهم : جاء بعلق فلق ؛ وهي الداهية ؛ لا يجرى [ مجرى عمر ] . يقال منه : أعلقت وأفلقت ؛ أي جئت بعلق فلق . ومر يفتلق في عدوه ؛ أي يأتي بالعجب من شدته .\n","ar.miqbas":"قُلْ أَعُوذُ بِرَبِّ الْفَلَقِ (1) الأمر بالقول يقتضي المحافظة على هذه الألفاظ لأنها التي عينها الله للنبيء صلى الله عليه وسلم ليتعوذ بها فإجابتُها مرجوة ، إذ ليس هذا المقول مشتملاً على شيء يُكلف به أو يُعمل حتى يكون المراد : قل لهم كذا كما في قوله : { قل هو الله أحد } [ الإخلاص : 1 ] ، وإنما هو إنشاء معنى في النفس تدل عليه هذه الأقوال الخاصة .وقد روي عن ابن مسعود في أنه سأل النبي صلى الله عليه وسلم عن المعوذتين فقال : \" قِيل لي قُل فقلتُ لكم فقولوا \" . يريد بذلك المحافظة على هذه الألفاظ للتعوذ وإذ قد كانت من القرآن فالمحافظة على ألفاظها متعينة والتعوذ يحصل بمعناها وبألفاظها حتى كَلِمة { قُل .والخطاب بقُل } للنبيء صلى الله عليه وسلم وإذ قد كان قرآناً كان خطاب النبي صلى الله عليه وسلم به يشمل الأمة حيث لا دليل على تخصيصه به ، فلذلك أمر النبي صلى الله عليه وسلم بعضَ أصحابه بالتعوذ بهذه السورة ولذلك أيضاً كان يعوِّذ بهما الحَسَن والحُسَيْن كما ثبت في «الصحيح» ، فتكون صيغة الأمر الموجهة إلى المخاطب مستعملة في معنَيي الخطاب من توجُّهه إلى معيّن وهو الأصل ، ومن إرادة كلّ من يصح خطابُه وهو طريق من طرق الخطاب تدل على قصده القرائن ، فيكون من استعمال المشترك في معنييه .واستعمال صيغة التكلم في فعل { أعوذ } يتبع ما يراد بصيغة الخطاب في فعل { قل } فهو مأمور به لكل من يريد التعوذ بها .وأما تعويذُ قارئها غيرَه بها كما ورد أن النبي صلى الله عليه وسلم كان يعوذ بالمعوذتين الحسن والحسين ، وما رُوي عن ع